484,Elle KIM：跨国界监管将成为未来金融科技一大风险,"2017年3月23日，在博鳌亚洲论坛2017年年会“金融科技（FinTech）：科技，还是金融？”分论坛上，三星电子副总裁Elle KIM表示，在未来，金融科技将在移动支付和整体生态系统上取得更大发展，现在的数据将成为未来的货币，人们的生活也将变得更加美好。
KIM认为，金融科技企业应加强合作，不单打独斗，与合作伙伴共同打造良好的生态系统。但与此同时，金融科技具有跨国界的特点，如何实现跨国界监管，将是未来金融科技可能面临的一大风险。金融科技企业应与其他国家的伙伴积极展开合作，听取各行业人士、监管机构及各地政府的意见，承担自身企业责任，确保产品的安全性。
"
485,邱勇：未来大学的最大特征是开放性和国际化,"2017年3月23日，在博鳌亚洲论坛2017年年会“未来的教育”分论坛上，清华大学校长邱勇认为，未来大学有其新的特征，最大特征是开放性：经济全球化，教育则是国际化，尤其是大学。
清华大学2016年制定全球战略，而在4月29日，15所亚洲最优秀的大学将在清华大学共同成立亚洲大学联盟，探讨亚洲共同价值，提升亚洲大学的全球话语权联盟，培养未来的杰出人才。届时发布的第一篇《亚洲高校年度报告》，将会反映全球化阶段，亚洲大学自己的观点。邱勇表示，高等教育不应该只有一种声音，东方教育思想有很多传承和珍惜的内容。
"
486,计葵生：传统数据需与新型大数据相结合,"2017年3月23日，在博鳌亚洲论坛2017年年会“金融科技（FinTech）：科技，还是金融？”分论坛上，上海陆家嘴国际金融资产交易市场股份有限公司联席董事长兼CEO计葵生表示，国内许多互联网公司拥有技术，却缺乏金融能力。因此，中国传统金融机构与科技公司在未来5年内具有巨大的合作空间。
与此同时，传统数据需与新型大数据相结合，在信用与融资、对投资的理解，以及匹配的逻辑方面耐心积累，保持并发挥传统金融的优势。传统金融机构不应对新技术、模型、数据过分自信，而应始终结合外部环境进行判断，并重视数据安全。
"
487,刘良：教育要先行，人才是关键,"2017年3月23日，在博鳌亚洲论坛2017年年会“未来的教育”分论坛上，澳门科技大学校长刘良表示，一般投资领域，进行最大投资的应该是能够有最大经济产出的领域。但在教育领域，则首先应该投资的是基础教育；其次是根据发展重点，选择发展项目，培育创新性人才。
刘良认为，教育要先行，人才是关键。
"
488,陈生强：真正的金融科技应尊重金融的本质,"2017年3月23日，在博鳌亚洲论坛2017年年会“金融科技（FinTech）：科技，还是金融？”分论坛上，京东金融CEO陈生强表示，互联网金融、金融科技与科技金融，是3个不同的概念。
“互联网金融”的实质是渠道的拓展，即以互联网为销售渠道售卖金融产品；“金融科技”是技术的革命，即利用大数据、人工智能、区块链等科技手段为金融机构服务；“科技金融”则是企业利用科技手段为自身服务。
陈生强认为，真正的金融科技应当尊重金融的本质，做好风险定价，以数据为基础，以技术为手段，为传统金融机构服务，帮助其提高效率、降低成本、增加收入。
"
489,胡滨：中国在互联网金融领域排名世界第一，国际化是必然趋势,"2017年3月23日，博鳌亚洲论坛2017年会新闻发布会暨博鳌亚洲论坛学术发布会举行。在会后的记者群访中，中国社科院金融研究所副所长胡滨表示，目前中国在互联网金融领域已达到世界第一的水平，未来走向国际化是必然趋势。
胡滨认为，中国互联网金融的国际化道路分为两个阶段，第一阶段是以支付体系为突破口，在场景支付、国际贸易领域进行产品的国际化；第二阶段是在外国民众及经济体普遍接受中国互联网金融产品的基础上，进行机构的国际化，如控股其国内金融机构等。
"
490,胡滨：“智能投顾”或是2017年互联网金融领域最大的“黑天鹅”,"2017年3月23日，博鳌亚洲论坛2017年会新闻发布会暨博鳌亚洲论坛学术发布会举行。在会后的记者群访中，中国社科院金融研究所副所长胡滨表示，随着大数据、云计算和人工智能等科技的发展，智能投顾已成为资产管理行业的一大趋势。
胡滨同时也指出，目前资产管理行业的监管进度与技术进步的速度不匹配，造成了监管与技术进步的暂时性脱节。在这样的背景下，“智能投顾”或成为2017年互联网金融领域最大的“黑天鹅”。
"
491,胡滨：创新监管新机制，引入中国版“监管沙盒”,"2017年3月23日，博鳌亚洲论坛2017年会新闻发布会暨博鳌亚洲论坛学术发布会举行。在会后的记者群访中，中国社科院金融研究所副所长胡滨详细介绍了“监管沙盒”的起源、设计和意义。
胡滨建议，在一行三会之上建立一个实体的协调机构，该机构下设金融创新中心，由金融创新中心负责“监管沙盒”的运作，以期平衡金融创新和风险。“监管沙盒”在一定程度上可以缓释，监管立法规则滞后造成的风险，促进金融监管机制的改革。
"
492,胡滨：中国互联网金融健康可持续发展十原则,"3月23日上午，博鳌亚洲论坛 2017年会新闻发布会暨博鳌亚洲论坛学术发布会召开，中国社科院金融研究所副所长胡滨出席并发布《互联网金融报告2017》。
胡滨提出了推动中国互联网金融健康可持续发展的十条高级原则，并指出，中国互联网金融目前已经具备了“沙盒监管”的基础条件，他呼吁尽快引入中国版的“监管沙盒”。十条原则如下：
一，强化互联网金融普惠金融和服务实体经济的政策导向；
二，深化监管体制改革，防止分业监管与跨界经营的制度性错配；
三，转变监管理念，实施主动式、包容性监管；
四，创新监管新机制，引入中国版“监管沙盒”；
五，运用监管科技，提升监管技术水平；
六，注重权益保护，健全消费者保护机制；
七，完善基础设施，夯实可持续发展基础；
八，坚守数据安全，防范技术风险；
九，强化信息披露，提升行业透明度；
十，深化行业自律，净化生态体系。
"
493,胡滨：金融创新与规范发展成为今年互联网金融主题,"3月23日上午，博鳌亚洲论坛 2017年会新闻发布会暨博鳌亚洲论坛学术发布会召开，中国社科院金融研究所副所长胡滨出席并发表《互联网金融报告2017》。
胡滨表示，2017年是中国互联网金融监管的元年，在此背景下，互联网金融将在“创新”与“规范”的合力之下曲折前行。
目前，新科技在金融领域，无论是在大数据、云计算、人工智能还是区块链技术领域，都不断深入发展。
"
494,王军：中国整体经济活力和竞争力依然排在亚洲首位,"3月23日上午，博鳌亚洲论坛 2017年会新闻发布会暨博鳌亚洲论坛学术发布会召开，中国国际经济交流中心信息部部长王军出席并发布《博鳌亚洲论坛亚洲竞争力2017年度报告》。
报告指出，中国综合竞争力比较均衡的，整体经济活力竞争力表现非常突出，排在首位。
第一，中国规模总量在区域内最大，中国的中高速增长对于世界经济的贡献非常大，整体活力优势表现明显；第二，随着中国政府实施的新一轮行政审批权力下放和审批制度改革，营商环境在持续改善；第三，中国正朝着创新驱动国家稳步迈进；最后，中国城市化的进程在加快。
"
495,王军：亚洲主要经济体2016年度综合竞争力排名维持相对稳定，中国排名第九,"3月23日上午，博鳌亚洲论坛 2017年会新闻发布会暨博鳌亚洲论坛学术发布会召开，中国国际经济交流中心信息部部长王军出席并发布《博鳌亚洲论坛亚洲竞争力2017年度报告》。
报告指出，过去一年，世界政治经济出现较大起伏和变化，但亚洲主要经济体的竞争力并未受到很大影响。亚洲主要经济体2016年度综合竞争力排名仍维持相对稳定地位，多数经济体综合竞争力排名没有出现大的变化。
亚洲竞争力排名前十位依次是新加坡、中国香港、韩国、中国台湾、澳大利亚、新西兰、以色列、日本、中国、卡塔尔。
"
496,林桂军：全球价值链可能出现危机,"3月23日上午，博鳌亚洲论坛 2017年会新闻发布会暨博鳌亚洲论坛学术发布会召开，对外经济贸易大学副校长林桂军出席并发布《博鳌亚洲论坛亚洲经济一体化进程2017年度报告》。
林桂军表示，过去20到30年里驱动亚洲经济增长最重要的因素――全球价值链可能出现危机。
金融危机爆发之后，全球贸易萎缩，东亚贸易减速。亚洲贸易的60%（或以上）是中间品的贸易，中间品贸易也是衡量全球价值链变化的重要指标。如果中间品贸易下降，说明全球价值链活跃度降低。当然，也可能说明全球价值链更趋成熟。
林桂军认为，亚洲进口的下降，将会对全球价值链产生巨大影响。
"
497,姚枝仲：新兴经济体宏观经济形势趋于稳定，但脆弱性提高,"3月23日上午，博鳌亚洲论坛 2017年会新闻发布会暨博鳌亚洲论坛学术发布会召开，中国社科院世界经济与政治研究所副所长姚枝仲出席并发布《博鳌亚洲论坛新兴经济体发展2017年度报告》。
该报告总结了新兴经济体重要的特征并指出三大趋势：
第一，总体宏观经济形势趋于稳定；
第二，新兴经济体就业与收入持续增长；但姚枝仲也在发布会上指出，不是所有的国家都在趋好，有很少一部分国家的经济形势还在继续恶化，如阿根廷、南非、沙特等。
第三，新兴经济体国家的脆弱性在不断提高。
"
498,周文重：“一带一路”是本次博鳌论坛的重要议题,"3月23日上午，博鳌亚洲论坛 2017年会新闻发布会暨博鳌亚洲论坛学术发布会召开，博鳌亚洲论坛秘书长周文重出席并致辞。
对于为什么选择“一带一路”作为四个专题之一，周文重表示，习近平主席提出“一带一路”倡议已经三年有余。该倡议提出之后得到一百多个国家和国际组织的响应，中国目前也已经和60多个国家签署合作谅解备忘录。
周文重指出，从某种意义上来，“一带一路”是中国版的全球化一个设想，如果各国的目标都能够在“一带一路”大的盘子里面加以推进，走向命运共同体是可以预期的。
"
499,周文重：全球化到了一个关口，共商共建共享办法，走出一条新路,"3月23日上午，博鳌亚洲论坛 2017年会新闻发布会暨博鳌亚洲论坛学术发布会召开，博鳌亚洲论坛秘书长周文重出席并致辞。
周文重介绍了本次博鳌论坛年会的筹备情况，他表示：“全球化已经到一个关口，本次论坛的意义在于共商共建共享办法，走向命运共同体，走出一条新路。”
据周文重介绍，围绕“直面全球化和贸易自由化”这一主题，本次博鳌共组织了65场活动，分成四个板块，包括全球化、增长、改革、新经济。
"
500,周文重秘书长：逆全球化是短视行为 各国更应同舟共济,"2017年3月22日，博鳌亚洲论坛秘书长周文重在接受中国日报采访时表示，如今经济发展处于下行周期，全球化发展到了一个关口，发展中国家和新兴经济体的进一步发展离不开全球化。
周文重称，在全球经济低迷、贸易量较少、投资较低、债务较高、对货币政策依赖程度较大的背景下，各国更应同舟共济，寻求普惠、共享的发展。
据悉，博鳌亚洲论坛2017年年会以“全球化与自由贸易”作为论坛主题，1727位与会代表将围绕全球化、增长、改革、创业创新与新经济、文化等议题，参加65场活动，其中包括44场讨论会和17场年度会议。
周文重认为，全球化不是抽象的概念，习近平主席3年前提出的一带一路倡议正是中国版实现全球化的方案，通过共商、共建、共享，推动人类命运共同体的建立。
"
501,重要通知,"博鳌亚洲论坛2017年年会开幕大会，将于3月25日上午9时，在博鳌亚洲论坛国际会议中心二层，主会场举行。根据安保要求，通往博鳌亚洲论坛国际会议中心的道路，将于上午8时15分，开始实施交通管控。如您住在博鳌亚洲论坛大酒店和东屿岛大酒店之外，请确保在此之前抵达博鳌亚洲论坛国际会议中心。为保证与会嘉宾准时出席开幕大会，组委会25日的巴士将从早上06:30开始。
进入开幕大会会场，需进行全面安检，请预留足够时间，嘉宾入场时间为07:30-08:30, 此后停止入场。
博鳌亚洲论坛秘书处
二一七年三月二十二日
(查看英文)
"
502,中国国务院副总理张高丽将应邀出席博鳌亚洲论坛2017年年会,"2017年3月20日，外交部发言人华春莹宣布，中国国务院副总理张高丽将于3月25日应邀出席在海南博鳌举行的博鳌亚洲论坛2017年年会开幕式并发表主旨演讲。
马达加斯加总统埃里、密克罗尼西亚联邦总统克里斯琴、尼泊尔总理普拉昌达、阿富汗议会长老院主席穆斯利姆亚尔、缅甸副总统吴敏瑞等外国政要将应邀出席年会。
"
503,为人类共同的命运鼓与呼,"---中国政协传媒网对话博鳌亚洲论坛秘书长周文重
英国公投“脱欧”，欧盟成员各怀心事；特朗普“美国优先”政策，引发全球担忧；金融、债务、难民三重危机，欧洲上空阴云密布……，“黑天鹅”接踵飞来。全国政协常委、外事委员会副主任，博鳌亚洲论坛秘书长周文重认为，全球化在欧美遇挫，有必要通过每年一次的博鳌亚洲论坛年会，为全球化明是非、正视听，为更具包容性的全球化鼓与呼。
全国两会期间，就全球化、博鳌亚洲论坛、“一带一路”、人类命运共同体等相关话题，中国政协传媒网对周文重进行了专访。
中国政协传媒网：过去一年，逆全球化而动的各种民粹主义、贸易保护主义、单边政策正在抬头，您认为，全球化面临挑战的深层次原因有哪些？全球化前景如何？
周文重：全球化是大家关注的一个问题。全球化是一个客观的大趋势，通过全球化，发达国家也好、发展中国家也好，都从中得到了很大的好处。世界的可持续性发展和全球化是分不开的。我认为，推动全球化的根本动力不是人的主观愿望，而是市场的内生需求。
但是从发达国家来讲，由于他们内部的利益分配机制存在问题，利益过多的集中在少数人手上，财富聚集在少数人手上，大多数民众从中受益比较少或者很少，他们误认为现在所面临的一些问题是全球化给他们带来的，对全球化本身产生了疑虑。另外，有些政治团体出于政治的需要、选票的需要，也一定程度上误导了民众对于全球化的看法，把西方现在出现的问题和困难归咎于全球化，这样的做法，我认为是短视的。
当然，全球化本身也存在一些问题。比如，制定新的世界规则时，缺少保障其公平有效的程序和渠道，因为原来的国际规则主要是由发达国家来制定的；现在，随着发展中国家的经济实力的增长，国力的发展壮大，发展中国家希望能够得到应有的发言权，这是合情合理的，这些问题都有待解决。
我觉得，这是全球化过程当中，必然会出现的一些问题。只要国际社会能够坐下来，把这些问题放在桌面上，进行充分的沟通交流，谋求一个合理的解决方案，我想，全球化还是有很好的未来的。
中国政协传媒网：博鳌亚洲论坛至今已经举办了16年，您认为它是否发挥了应有的作用？
周文重：作为亚洲和新兴经济体的主要对话平台之一，博鳌亚洲论坛一直致力于推动区域合作，目标是促进地区的一体化。从这个意义上来讲，博鳌论坛成立16年来，应该说发挥了它应有的作用。
我们的理事有19位，理事会定期召开，理事有亚洲或者其它地区国家的前政要，也有世界重要的企业界和学术界人士，理事会有广泛的代表性。我们每年的年会都有六七十场活动，议题非常广泛，全球化、贸易自由化等方方面面的问题都涉及到。发出亚洲的声音，凝聚亚洲共识，是我们的初衷。从这个角度讲，16年来，博鳌论坛实现了成立时的初衷。
中国政协传媒网：博鳌论坛2017年年会开幕在即，今年最大的亮点是什么？
周文重：最大亮点是我们的主题。经广泛征求各方意见，我们把2017年年会的主题确定为“直面全球化与自由贸易的未来”。
当前，全球化在欧美遇挫，有必要通过每年一次的博鳌亚洲论坛年会，为全球化明是非、正视听，为更具包容性的全球化鼓与呼。
我们在今年年会上做这个题目，主要是希望把全球化的方方面面梳理清楚，争取达成共识。在本次年会上，我们还准备通过一个关于全球化的倡议。
中国政协传媒网：今年年会设置的议题有哪些？对“一带一路”有何体现？
周文重：今年年会共有65场活动，包括45场分论坛、17场圆桌会和若干闭门对话，将邀请6位领导人、80多位国际组织负责人和有关国家负责经济事务的部长与会。年会将为领导人及部长们与企业家近距离交流创造机会。
议题主要围绕全球化、增长、改革、新经济四个方面。在全球化部分，年会将安排一场沿线国家政要同相关专家、学者的对话。在增长方面，年会将从多个角度探讨增长问题。此外，2017年是亚洲金融风暴爆发20周年和次贷危机爆发10周年，年会安排了两场分论坛，分别对两场危机进行反思。年会第三个重点是关于改革，下设的议题包括供给侧结构性改革、医改、土地制度改革、财政改革等。第四个重点是创业、创新与新经济，包括工业设计、人工智能、虚拟现实、直播经济、互联网汽车等议题。
“一带一路”倡议目前得到了一百多个国家和国际组织的响应，中国政府也和65个国家签了相应的合作谅解备忘录。“一带一路”倡议，不仅事关全球经济的可持续发展，也事关国际秩序与规则体系的和平转型与再造，这是“和平与发展”两大时代主题在21世纪的升华和具体体现。
博鳌亚洲论坛作为一个非官方区域组织，愿意提供一个平台，供大家就“一带一路”问题来展开深入的讨论，看看怎么助推“一带一路”这样一个目标的落实、落地，所以你看我们的日程，其中就有与“一带一路”有关的峰会。
中国政协传媒网：您如何理解“构建人类命运共同体”与“一带一路”两者间的关系？
周文重：中共十八大以来，习近平总书记先后提出了两个具有划时代意义的学说和倡议，一是携手共建人类命运共同体的学说，二是携手共建“一带一路”的倡议。这两大学说和倡议，有一个相同的时代背景，那就是，二战后建立的国际秩序与规则体系越来越难以为继，新的秩序与规则体系尚未形成。正是在这样的历史关头，习近平总书记提出了构建人类命运共同体。2016年，我们博鳌亚洲论坛就是以“亚洲新未来：迈向命运共同体”为主题开过年会。
我理解，构建人类命运共同体也需要共建共享，跟“一带一路”的目标是一致的。当然，各国政治制度不一样，意识形态也可能不一样，但是都面临着如何保持发展、增长的这么一个共同的挑战。
我担任博鳌亚洲论坛秘书长这几年来的工作经历，使我强烈感受到“一带一路”倡议在沿路沿线国家的受欢迎程度，也强烈感受到我国企业参与“一带一路”项目的高度积极性。因此我认为，各国共建开放、包容、均衡、共赢的“一带一路”，是实现人类命运共同体一个非常有效的途径。
中国政协传媒网：“一带一路”正处于关键阶段，您认为应该如何推进“一带一路”倡议落地深耕？
周文重：正如你说的，“一带一路”当前正处于相当关键的阶段。我认为推进“一带一路”倡议落地，要注重系统性，防止碎片化。我简要谈三点：
一是要充分认识“一带一路”的深远意义。“一带一路”倡议不仅是促进全球各区域开展广泛经济合作的推进器，更是我国积极参与、改革完善现有国际秩序与规则，争取我国制度性权利的战略杠杆。通过推进“一带一路”倡议，一方面可以携手各国共促可持续发展；另一方面，可以通过一个个具体的合作项目，改革和再造国际贸易投资规则，完善金融货币制度，营造更加公平合理的政治经济新秩序框架。
二是在落实“一带一路”具体项目时，必须高度重视相关制度规则的建立或完善。推进“一带一路”倡议，必须坚持贸易投资项目的建设，同贸易投资制度规则的建设紧密结合，从制度规则上保障合作项目的互利共赢，促进相关秩序与规则的完善。并应结合“一带一路”的实际，推动建立全球投资保障和仲裁机制，对我国沿路沿线项目提供系统的制度性保障。
三是发挥我国自身优势，“三电”先行。跨国电信、电商、电网的互联互通建设，不仅具有投资规模相对小、周期相对短、系统性落地相对较易的特点，而且我国企业在这“三电”领域，都具有制定标准规则的技术实力和明显的市场优势。“三电”先行，将使“一带一路”的系统性落地达到事半功倍的效果，也必将使我国在上述三个领域掌握主导权和制度性话语权，为最终构建人类命运共同体的国际新秩序，发挥重要的引领作用。
消息来源：中国政协传媒网

(查看英文)
"
